Class Label Short,File Name,Transcript
N,NH_ML_001_N_M_003_012,ഒരു മനുഷ്യൻ ഈ ഭൂമി ലോകത്ത് ജനിക്കുന്നുണ്ടെങ്കിലും ഈ ഭൂമിലോകത്ത് ജീവിക്കുന്നുണ്ടെങ്കിലും മരിക്കുന്ന സമയത്ത് അറിയപ്പെടുന്നത് അദ്ദേഹത്തിന്റെ ബാഗ്രൗണ്ട് നിശ്ചയിക്കപ്പെടുന്നത് അദ്ദേഹം ജീവിതകാലത്ത് തീരുമാനത്തിന്റെയും പ്രവർത്തനത്തിന്റെയും ബലം ആണ്
N,NH_ML_001_N_M_003_013,ഓരോരുത്തരും ജനിച്ചു വീഴുന്നത് പല സാഹചര്യങ്ങളും നമ്മുടെ കൺട്രോളിൽ അല്ല പക്ഷേ ജീവിക്കുന്ന ഓരോ നിമിഷവും ഓരോ സെക്കൻഡും നമ്മുടെ കയ്യിലാണ് നമ്മുട കൺട്രോൾ ആണ്
N,NH_ML_001_N_M_003_014,കഷ്ടപാടിലാണോ അതോ പണക്കാരൻ ആയിട്ടാണ് ജീവിക്കേണ്ടത് നിങ്ങളുടെ തീരുമാനമാണ് ശെരിക്കും ഈ ലോകത്തില് നമ്മുടെ സാധ്യതാ എന്തിന് നമ്മുക് അറിയില
N,NH_ML_001_N_M_003_015,ശ്രമിച്ചിട്ടുണ്ടോ എന്ന് ഞാൻ നിങ്ങൾക്ക് പറഞ്ഞു തരാം നമ്മുടെ പ്രപഞ്ചത്തികൾ ഉണ്ട് നമ്മുടെ ഭൂമിയിലുള്ള മണൽത്തരികൾ മുഴുവനും നമ്മുടെ ഗാലക്സി നമ്മുടെ ഗാലക്സിയായി ഏകദേശം 100 ബില്ലിംഗ് ഉണ്ട് അതായത് ഭൂമിയുണ്ടോ എന്ന് പോലും ശാസ്ത്രജ്ഞ കണ്ടുപിടിക്കാൻ കഴിഞ്ഞിട്ടില്ല
N,NH_ML_001_N_M_003_016,വിശ്വസിക്കാവുന്നതിലും അപ്പുറം ചെറുതാണ് സംസാരിക്കുന്ന ഞാനും കേൾക്കുന്ന നിങ്ങളും ഈ ലോകത്തുള്ള എല്ലാവരും കൂടുതൽ മനസ്സിലാക്കിയത് നമ്മുടെ പ്രപഞ്ചത്തിലുള്ള ഒരു ചെറിയ പൊടിപടലമാണ് നമ്മുടെ ഭൂമി മാത്രമാണ് സംസാരിക്കുന്നത് ഏത് പാവപ്പെട്ടവനും ഭൂമിയുടെ മക്കളായി നമ്മൾ എല്ലാവരും ഒരുപോലെ തന്നെയാണ് ഇവിടെ പക്ഷേ
N,NH_ML_001_N_M_003_017,പക്ഷേ എന്തുകൊണ്ട് ഇവിടെ ചിലർ വ്യത്യസ്തരായി എന്തുകൊണ്ട് ചിലർ ഇവിടെ മഹാന്മാരെ എന്തുകൊണ്ട് ചിലർ മാത്രമേ ഇവിടെ അറിയപ്പെട്ടവരും ബഹുമാനിക്കപ്പെട്ടവരുമായി മാറിയെന്ന് ചരിത്രം പറയുന്നു
N,NH_ML_001_N_M_003_018,തീരുമാനിക്കേണ്ടത് ചോദിച്ചു മാത്രമായിരിക്കും ഒരിക്കലും നിന്നെ സാഹചര്യങ്ങൾ ആയിരിക്കരുത് സിറ്റുവേഷൻസ് എല്ലാം മാറി മാറിക്കൊണ്ടിരിക്കും മാരത്തിരികെടത്ത് നമ്മുടെ സ്വഭാവം ആണ്
N,NH_ML_001_N_M_003_019,പലരും പലതും പറയും പക്ഷേ നിന്റെ മാറ്റു നിനക്ക് മാത്രം ഉണ്ടാക്കാൻ കഴിയൂ നിനക്ക് ഈ ഭൂമിയിൽ എന്തെങ്കിലും ഒന്ന് കുറിച്ചുവെക്കണമെങ്കിൽ നിൻറെ ഉള്ളിലുള്ള ധീരനെ ഉണർത്തണം എല്ലാവർക്കും അറിയാം അദ്ദേഹത്തിന്റെ മനസ്സ് പൊരിച്ചത് എന്നാൽ ആഗ്രഹങ്ങളുടെ ചില കരിഞ്ഞു വീഴ്ത്തിക്കൊണ്ട് അദ്ദേഹത്തിന്റെ ഇരുപതാമത്തെ വയസ്സിൽ എന്ന ഒരു അപൂർവ രോഗം പിടിപെടുന്നു അദ്ദേഹത്തിന്റെ ശരീരഭാഗങ്ങൾ ഒന്നിന് പുറകെ ഒന്നായി നിലച്ചു
N,NH_ML_001_N_M_003_020,ശരീര പ്രവർത്തനങ്ങൾ നിലച്ചു എങ്കിലും അദ്ദേഹത്തിൻറെ തീവ്രമായ ആത്മവിശ്വാസം നിലച്ചിട്ടില്ലായിരുന്നു അദ്ദേഹത്തിലുള്ള വിശ്വാസം സ്വന്തമായി ഒരു കാര്യവും ചെയ്യാനോ കഴിഞ്ഞിട്ടില്ലായിരുന്നു സ്വന്തമായി ചാടിക്കാൻ പോലും കഴിയാതിരുന്ന അദ്ദേഹം തലച്ചോറ് കൊണ്ട് ലോകം തന്നെ ചലിപ്പിച്ചു
N,NH_ML_001_N_M_003_021,പ്രതിസന്ധികളുടെ പാതയിലൂടെ എഴുതി നീങ്ങിക്കൊണ്ട് അദ്ദേഹം ഈ ലോകത്ത് തന്നെ പ്രശസ്തരായ ശാസ്ത്രജ്ഞന്മാരിൽ ഒരാളായി മാറി ഇത്രയും ന്യൂനതയുള്ള ഇത്രയും കുറവുകളും അദ്ദേഹത്തിനുവരെ ഈ ലോകത്ത് നാട്ടുകാർപ്പെടുത്താൻ കഴിഞ്ഞില്ലെങ്കിലും നിങ്ങൾക്ക് എന്തുകൊണ്ട് സാധിക്കുന്നില്ല എന്തുകൊണ്ട് കഴിയുന്നില്ല
N,NH_ML_001_N_M_003_022,എന്തൊരു പ്രതിസന്ധികൾ വന്ന് തട്ടി വീതം ശ്രമിച്ചാലും ഇനി എന്നെ തകർക്കാനാവില്ല ഇങ്ങനെയാവണം ഇന്ത്യ നിനക്ക് ആഗ്രഹത്തിന്റെ ലക്ഷ്യത്തിന്റെ പ്രതിസന്ധികൾ അട്ടിമറിച്ചു കൊണ്ട് സഞ്ചരിക്കാൻ പഠികു
N,NH_ML_002_N_F_002_001,ഒരിക്കലും ജീവിതത്തിൽ വിട്ടു കൊടുക്കരുത്
N,NH_ML_002_N_F_003_001,ഒരു ബന്ധത്തിനായി ഒരിക്കലും യാചിക്കരുത് നിങ്ങളോടൊപ്പം ഉണ്ടാകാൻ ആഗ്രഹിക്കുന്നവന് സ്വീകരിക്കാനും നിങ്ങളോടൊപ്പമുണ്ട് നടിക്കുന്നവനെ നിരസിക്കാൻ
N,NH_ML_002_N_F_003_002,നേടിയെടുത്ത അതിനേക്കാൾ എത്രയോ ഭംഗിയുണ്ട് അത്രമേൽ ഇഷ്ടം ആയിട്ടും കൈവിട്ടുപോയ നഷ്ടപ്പെടലുകൾ ക്കു
N,NH_ML_002_N_F_003_003,സമയം വാക്ക് അവസരം എന്നീ മൂന്ന് കാര്യങ്ങൾ ഒരിക്കലും തിരികെ വരില്ല അതിനാൽ സമയം പാഴാക്കാതിരിക്കുക വാക്കുകൾ സൂക്ഷിച്ച് ഉപയോഗിക്കുക അവസരം നഷ്ടപ്പെടുത്താതിരിക്കുക
N,NH_ML_002_N_F_003_004,പിന്നിലേക്ക് നോക്കിയാൽ എല്ലാം നമ്മളിൽ നിന്ന് അകന്നു പോവുകയുള്ളൂ മുന്നിലേക്ക് നോക്കൂ എല്ലാം നമ്മളെ തേടി വരും
N,NH_ML_002_N_F_003_005,സത്യം അറിയുന്നവരെ മുന്നിൽ കള്ളും കൊണ്ട് അഭിനയിക്കുമ്പോൾ സൂക്ഷിക്കുക
N,NH_ML_002_N_F_003_006,സ്നേഹം ആയാലും ബഹുമാനം ആയാലും കരുതൽ ആയാലും അർഹിക്കുന്നവർക്ക് മാത്രമേ കൊടുക്കാവൂ ഇങ്ങോട്ട് കിട്ടാത്തത് ഒന്നും തിരിച്ചു കൊടുക്കേണ്ട ബാധ്യത നമുക്ക് ആർക്കുമില്ല
N,NH_ML_002_N_F_003_007,അർഹതയില്ലാത്തവർക്ക് ലൈഫിൽ ഇടം കൊടുത്തും പ്രാധാന്യം കൊടുത്തും നമ്മൾ ഇതൊന്നു വാങ്ങുന്നതാണ് നമ്മുടെ ദുഃഖം
N,NH_ML_002_N_F_003_008,തമാശയായിട്ടാണ് എങ്കിലും മറ്റുള്ളവരുടെ മുൻപിൽ വച്ച് ആരെയും തരംതാഴ്ത്തി സംസാരിക്കരുത് മുഖഭാവത്തിൽ അവർ പ്രകടമാക്കി ഇല്ലെങ്കിലും ഉള്ളിനുള്ളിൽ അവർ ഒരുപാട് വേദനിക്കുന്നു ഉണ്ടാവും
N,NH_ML_002_N_F_003_009,എനിക്ക് ആരുടെയും ആവശ്യമില്ലെന്ന് അഹങ്കാരവും എല്ലാവർക്കും എന്നെ ആവശ്യമായി വരുമെന്ന് വ്യാമോഹവും പാടില്ല
N,NH_ML_002_N_F_003_010,എല്ലാവരും മൗനംപാലിക്കുന്നു പക്ഷേ അവൻറെ തിന്മയെ കുറിച്ചാണ് ചർച്ച എങ്കിൽ ഊമ പോലും സംസാരിക്ക്
N,NH_ML_002_N_F_003_011,സമ്പത്തിന് ജീവിതരീതിയും മാത്രമേ മാറ്റാൻ കഴിയൂ തലയിലെഴുത്ത് മാറ്റാൻ കഴിയില്ല
N,NH_ML_002_N_F_003_012,എത്ര ഉന്നതസ്ഥാനം ലഭിച്ചാലും എത്ര വലിയ ബിരുദങ്ങൾ നേടിയാലും സംസ്കാരം മാന്യവും മനുഷ്യത്വം പഠിച്ചില്ലെങ്കിൽ ആ വ്യക്തി തുല്യമാണ്
N,NH_ML_002_N_F_003_013,അവരുടെ സ്വഭാവം രണ്ടുതരമാണ് ആവശ്യമുള്ളപ്പോൾ അവർ തേൻപോലെ മധുരമായി സംസാരിക്കുന്നു ആവശ്യം കഴിഞ്ഞാൽ അവർ തേൾ പോലെ കുത്തി സംസാരിക്കു
N,NH_ML_002_N_F_003_014,മനപ്രയാസം എന്നത് മനസ്സിൽ വരുന്നതല്ല ചില മനുഷ്യരാൽ വരുന്നതാണ്
N,NH_ML_002_N_F_003_015,ഉറച്ച തീരുമാനവും തളരാത്ത മനസ്സും ഉണ്ടെങ്കിൽ ആകാശത്തോളം വലിപ്പമുള്ള വെല്ലുവിളികളെ പോലുള്ള ഭയമില്ലാതെ നേരിടാം
N,NH_ML_002_N_F_003_016,താങ്ങാനാവില്ല എന്ന് ഞാൻ കരുതിയ പലതിനോടും പൊരുത്തപ്പെടാൻ പഠിപ്പിച്ചത് എൻറെ സാഹചര്യങ്ങളാണ്
N,NH_ML_002_N_F_003_017,തെറ്റാണെന്ന് മനസ്സിലാക്കിയിട്ടും ന്യായീകരിക്കുന്ന വ്യക്തിയുടെ തർക്കിക്കാൻ നിൽക്കരുത് കാരണം ആ വ്യക്തിയുടെ മനസ്സിൽ ഞാനെന്ന ഭാവം ഉള്ള കാലത്തോളം എല്ലാം അവർ തന്നെയായിരിക്കും
N,NH_ML_002_N_F_003_018,സ്വന്തം സത്യം മുറുകെപ്പിടിക്കുന്ന വർക്ക് 1000 ശത്രുക്കൾ ഉണ്ടാകും മറ്റുള്ളവരെ   നുണക്കൊപ്പം സഞ്ചരിക്കുന്ന വർക്കും ആയിരം മിത്രങ്ങൾ
N,NH_ML_002_N_F_003_019,എന്താവും എന്നോർത്ത് പറയേണ്ടത് പറയാതിരുന്നാൽ പിന്നീട് പറയാൻ ജീവിതം അവസരം തന്നു വരില്ല പ്രതികരിക്കേണ്ടത് പ്രതികരിക്കുക തന്നെ വേണം
N,NH_ML_002_N_F_003_020,ചെറിയ ചെറിയ വാശികൾ നല്ലതാണ് ആരെയും തോൽപ്പിക്കാൻ അല്ല നമുക്ക് ജയിക്കാനുമല്ല സ്വന്തം നിലപാടിൽ
N,NH_ML_002_N_F_003_021,ദിവസങ്ങൾ കഴിയുമ്പോൾ ചിലരുടെ മനസ്സിൽ നമ്മുടെ സ്ഥാനം എന്താണ് എന്ന് അവർ തെളിയിച്ചു
N,NH_ML_002_N_F_003_022,വിലയറിയാതെ വലിച്ചെറിയുന്ന പലതും വില അറിയുമ്പോൾ വില കൊടുത്താലും വാങ്ങാൻ  കഴിയില്ല
N,NH_ML_002_N_F_003_023,സ്വയം മുന്നോട്ട് പോകുക കാരണം മറ്റാരും നിങ്ങൾക്കായി ഇത്  ചെയ്യുവാൻ പോകുന്നില്ല
N,NH_ML_002_N_F_003_024,സ്വപ്നം കാണുന്ന അതിനോടൊപ്പം അതിനുവേണ്ടി പരിശ്രമിച്ചാൽ മാത്രമേ അത് യാഥാർഥ്യത്തിലേക്ക് എത്തിക്കുവാൻ കഴിയും
N,NH_ML_002_N_F_005_001,പോയത് പോയി വരാനുള്ളത് വരും അതിനിടയിൽ ഉള്ളതിലല്ലെ കാര്യം
N,NH_ML_002_N_F_006_001,ആർക്കും ആരെയും പൂർണ്ണമായും മനസ്സിലാക്കാൻ പറ്റിയെന്നു വരില്ല കാരണം കടൽ കണ്ടു എന്നു പറയുന്നവരൊക്കെ കണ്ടത് തിരയും തീരവും മാത്രമാണ്.
N,NH_ML_002_N_F_006_002,മറ്റുള്ളവർ തങ്ങളുടെ പ്രശ്നങ്ങളെക്കുറിച്ചുള്ള കണക്കെടുപ്പ് നടത്തുമ്പോഴും തനിക്കു ലഭിച്ച സൗഭാഗ്യങ്ങളെ കുറിച്ച് എണ്ണുവാൻ സാധിക്കുന്നതാണ് ഒരു വ്യക്തിയുടെ സന്തോഷത്തിൽ
N,NH_ML_002_N_F_006_003,എല്ലായിപ്പോഴും മനുഷ്യൻ വിജയ കുറ്റപ്പെടുത്തുന്നു എന്നാൽ യഥാർത്ഥത്തിൽ തെറ്റുകളുടെയും അഭിനിവേശത്തിന്റെയും ബലഹീനതയുടെയും പ്രതിനിധിയാണ് അവന്റെ ജീവിതം
N,NH_ML_002_N_F_006_004,സന്തോഷം ഒളിച്ചിരിക്കുന്നത് വസ്തു വാക്കുകളിലോ സ്വർണത്തിലോ അല്ല ആത്മാവിലാണ്
N,NH_ML_002_N_F_006_005,കോപതോട് പോരാടാൻ പ്രയാസമാണ് എന്നാൽ വിവേകമുള്ള മനുഷ്യൻ അതിനെ നിയന്ത്രണത്തിൽ ആകുന്നു
N,NH_ML_002_N_F_006_006,ജ്യാനി ഒരു മനുഷ്യൻ ജയിക്കാൻ വേണ്ടി പോരാടുന്നു പക്ഷേ പരാജയപ്പെടാൻ സാധ്യതയുള്ളതിനാൽ നേരിടാനുള്ള പദ്ധതി തയ്യാറാക്കിയില്ലെങ്കിൽ അവൻറെ ബുദ്ധിയെക്കാൾ ഇരട്ടി വിഡ്ഢിത്തമുള്ളവനായി അവൻ മാറും
N,NH_ML_002_N_F_006_007,നേരത്തെ ഉറങ്ങുകയും രാവിലെ നേരത്തെ എഴുന്നേൽക്കുകയും ചെയ്യുന്നതിനേക്കാൾ രാത്രി വൈഗോള ഉണർന്നിരിക്കുന്ന ആളുകൾക്ക് കൂടുതൽ ഉണ്ട് എന്ന് പഠനങ്ങൾ പറയുന്നു
N,NH_ML_002_N_F_006_008,ഈ അകൽച്ച ബന്ധങ്ങളിലെ ആഴം തിരിച്ചറിയാൻ സാധിക്കും ഒരുപക്ഷേ നമ്മൾ അവർക്ക് കോമാളികൾ ആയിരിക്കാം
N,NH_ML_002_N_F_006_009,അകലചയിലും മൗനത്തിലും നമ്മുടെ മനസ്സ് കാണുന്ന മനസ്സ് തൊട്ടറിയുന്ന സൗഹൃദങ്ങളും ബന്ധങ്ങളും നമ്മുടെ കൂടെ കാണും. അല്ലാത്തവനിമിഷമാണ് അവരുടെ ആവശ്യത്തിനുവേണ്ടി സമീപിച്ചവരാ
N,NH_ML_002_N_F_006_010,പ്രശ്നങ്ങൾക്ക് മുന്നിൽ അടിപതറാതെ നിൽക്കണമെങ്കിലും അകൽച്ച ഗുണകരമായ അന്തരീക്ഷം സൃഷ്ടിക്കും അതിലൂടെ ഓരോ വ്യക്തിയും കൂടുതൽ കരുത്തരാകുകയും മാത്രമേ ഉള്ളൂ എന്ന് തിരിച്ചറിയുകയും ചെയ്യു
N,NH_ML_002_N_F_006_011,താൻ എടുത്ത തീരുമാനത്തിൽ അടിയുറച്ചു നിൽക്കാനുള്ള ആർജ്ജവും ഓരോരുത്തരും ഉണ്ടാകും
N,NH_ML_002_N_F_006_012,ആത്മവിശ്വാസമാണ് എറ്റവും വലിയ ആയുധം ഓരോ ദിവസവും ആതംവിശ്വത്തോട് തുടങ്ങുക അതൊരു പക്ഷേ വിജയം നൽകും പക്ഷേ ഏതു വേലുവില്യെയും നേരിടാനുള്ള ധൈര്യം നൽകും
N,NH_ML_002_N_F_013_001,സ്നേഹിക്കുക അതൊരു കഴിവാണ് സ്നേഹിക്കപ്പെടുക അതൊരു ഭാഗ്യമാണ് സ്നേഹം നഷ്ടപ്പെടാതെ സൂക്ഷിക്കുക അതൊരു ഉത്തരവാദിത്വമാണ്
N,NH_ML_002_N_F_013_002,പിന്തിരിഞ്ഞു നോക്കാതെ യാത്ര പറഞ്ഞു പോകുന്നവർ വീണ്ടും നിങ്ങളിലേക്ക് തിരിച്ചെത്തുന്നതെങ്കിൽ നിങ്ങളാണ് ശരിയെന്ന് കാലം അവരെ പഠിപിച്ടുണ്ടകും
N,NH_ML_002_N_F_013_003,[20-02-2024 23:39] Devika: നഷ്ടപ്പെട്ട സ്വപ്നങ്ങൾ കണ്ടുമുട്ടിയ മുഖങ്ങൾ ഒറ്റപ്പെടുത്തിയ ബന്ധങ്ങൾ എല്ലാം ഒരു പാഠമാണ് പഠിക്കാനും തിരിച്ചറിയുവാനും ഉള്ള പാഠം
N,NH_ML_002_N_F_013_004, ചിരിച്ചാൽ മാറുന്ന ദേശങ്ങളുണ്ട് ക്ഷമിച്ചാൽ തീരാവുന്ന തർക്കങ്ങൾ ഉണ്ട് തൊട്ടാൽ അറിയുന്ന പിണക്കങ്ങൾ ഉണ്ട് ഒരു വാക്കുകൊണ്ട് തീർക്കാവുന്ന സങ്കടങ്ങളും ഉണ്ട് പക്ഷേ ആരും ഒന്നിനും തയ്യാറല്ല എന്നാണ് യാഥാർത്ഥ്യം
N,NH_ML_002_N_F_013_005,[20-02-2024 23:39] Devika: മനസ്സിലാക്കാത്തവരുടെ മുന്നിൽ സങ്കടം എന്ന പുസ്തകം തുറക്കരുത് കാരണം പരിഹാസം എന്ന അർത്ഥം മാത്രമേ അതിലുണ്ടാവും
N,NH_ML_002_N_F_013_006,പരിഗണന കിട്ടാത്ത സ്ഥലങ്ങളിൽ നിന്നും പരിഭവമില്ലാതെ പിൻവഗുക
N,NH_ML_002_N_F_013_007,സ്വയം തുടച്ച കണ്ണുനീരും ഒറ്റയ്ക്ക് അനുഭവിച്ച ദുഃഖങ്ങളുമാണ് ഈ ജീവിതത്തിലെ ഏറ്റവും വലിയ പാഠങ്ങൾ
N,NH_ML_002_N_F_013_008,കഴുകൻ എത്ര ഉയരത്തിൽ പറന്നാലും വിശപ്പകറ്റാൻ ഭൂമി ആശ്രയിക്കുന്നു. അതുപോലെ തന്നെയാണ് നമ്മുടെ ജീവിതവും എത്ര ഉയരത്തിലാണ് എങ്കിലും ചില സന്ദർഭങ്ങളിൽ ഏറ്റവും താഴെയുള്ളവർ സഹായം വേണ്ടിവരും അതുകൊണ്ട് നിങ്ങൾ ആരെയും വിലകുറച്ചു കാണരുത്
N,NH_ML_002_N_F_013_009,[20-02-2024 23:41] Devika: എല്ലാവരെയും തൃപ്തിപ്പെടുത്തിക്കൊണ്ടും എല്ലാവരുടെയും ഇഷ്ടം നേടിക്കൊണ്ടും നിങ്ങൾക്ക് ജീവിക്കാൻ ആവില്ല എപ്പോഴും നിങ്ങൾ നിങ്ങളായിട്ട് തന്നെ ഇരിക്കുക മനസ്സിലാക്കുന്നവർ മനസ്സിലാക്കിയാൽ മതിയെന്ന് തീരുമാനിക്കുക
N,NH_ML_002_N_F_013_010, മനസ്സ് വല്ലാതെ തളർന്നിരിക്കുമ്പോൾ നമ്മൾ ഇഷ്ടപ്പെടുന്ന ഒരാളുടെ വാക്ക് അല്ലെങ്കിൽ ഒരു നോട്ടം അല്ലെങ്കിൽ ഒരു പുഞ്ചിരി അതുമതി എല്ലാം മറക്കാൻ
N,NH_ML_002_N_F_013_011,അവകാശപ്പെടാൻ മാത്രം കഴിയുന്ന രക്തബന്ധങ്ങളെ കാൾ എത്രയോ വലുതാണ് സ്നേഹിക്കാൻ മാത്രം കഴിയുന്ന സുഹൃത്ത് ബന്ധങ്ങൾ
N,NH_ML_002_N_F_013_012,അത്രമേൽ ചേർത്ത് നിർത്തിയിട്ടും മനസ്സിലാക്കാത്തവരിൽ നിന്ന് പുഞ്ചിരിയോടെ തിരിഞ്ഞു നടക്കണം നമ്മൾ ഉള്ളതും ഇല്ലാത്തതും അവർക്ക് തുല്യമാണ്
N,NH_ML_002_N_F_013_013,സ്നേഹം ഒരു തമാശയായി മാത്രം കാണുന്നവർക്കും ഒരാളെ സ്നേഹിക്കുവാനും ഉപേക്ഷിക്കുവാനും വളരെ നിസ്സാരമാണ് എന്നാൽ ആത്മാർത്ഥമായി സ്നേഹിക്കുന്നവർക്ക് ആ വേദന മതി ജീവിതം മുഴുവൻ സങ്കടപ്പെടാൻ
