Class Label Short,File Name,Transcript
C,H_ML_001_C_M_046_001,ഞാൻ കാണിച്ചു തരാം ഞാൻ ആരാണെന്ന് നീ വിചാരിച്ചത് ഞാൻ കാണിച്ചു തരാം നീ വാടാ മൈരേ
C,H_ML_001_C_M_046_002,എന്റെ ദേഹത്ത് തൊട്ടാൽ നിൻറെ കുണണ കടിച്ച് കീറി ഞാൻ വെക്കും
C,H_ML_001_C_M_046_003,എടാ പരമ നാറി തയോളി പുണ്ട മോനെ
C,H_ML_001_C_M_046_004,ഒരു അമ്പലം തന്നെയുണ്ട് നീ അവിടെ നോക്കടാ പരമ ചെറ്റ തയോളി യൂട്യൂബിന്റെ അകത്തു കയറി നോക്കടാ തന്തയില്ലാത്ത മൈരൻ തന്തയില്ലാത്ത മൈരൻ തന്തയില്ലാത്ത മൈരൻ തന്തയില്ലാത്ത പൂറി മോൻ
C,H_ML_001_C_M_047_001,എടാ മൈരേ
C,H_ML_001_C_M_047_002,കണ്ടാലും നിന്റെ പുഞ്ഞാണി പൊന്നാനി നോക്കിയിട്ട് ഇങ്ങനെ ഒരു കൊട്ട് തന്നാൽ ഉണ്ടല്ലോ നീ മല നടിച്ച് വീഴത്തേയുള്ളൂ
C,H_ML_001_C_M_048_001,എന്നെ തേച്ചിട്ട് പോയതല്ലേ  നീ പോയാൽ ഇവൾക്ക് രണ്ട് മൈരാടാ
C,H_ML_001_C_M_048_002,കുറച്ചു മുൻപ് ഒരാളെ എൻറെ വാട്സാപ്പിലേക്ക് ഒരു ചാറ്റ് ചെയ്തു അയാളുടെ മുഖം ഞാൻ കാണിക്കാം ഇത്രത്തോളം മൈർ പൂറിക്ക് മക്കളെ എനിക്ക് വെട്ടി മൂടി തയോകളോക്കെ മൈരന്മാർ
C,H_ML_001_C_M_048_003,അമ്മ ഒളി തള്ള ഊളി കയറി ഇങ്ങോട്ട് വരുവാ അവന്മാർക്ക് ഒന്നും പെണ്ണുംപിള്ളമാരില്ലേ പെണ്ണുമ്പിള്ള മാരുടെ കൂതി
C,H_ML_001_C_M_048_004,ചെറ്റ കുടിലിൽ ജീവിക്കുന്നവരെ അത്തരത്തിലുള്ളവരെ നിനക്കൊക്കെ  മര്യാദ പഠിപ്പിക്കാൻ പറ്റും അല്ലാതെ ഉള്ളവന്മാരുടെ ഒക്കെ അടുത്ത് ചെന്നാൽ  അവന്മാരുടെ ഒക്കെ രോമത്തിൽ തൊടാൻ പറ്റുമോ ഡാ പരമനാറി   ചെറ്റ
C,H_ML_001_C_M_048_005,നിൻറെ തന്ത
C,H_ML_001_C_M_048_006,നീ ഇല്ലാതെ വരും എടാ മൈരേ നീ നോക്കിക്കോ മൈരേ നീ എന്നെ ഓർത്ത്  ഭ്രാന്ത് പിടിച്ച് നീ ഇല്ലാതാകും
C,H_ML_001_C_M_048_007,പൂറി മോനെ വീടെടാ പട്ടി ഈ നാറീനെ ഒക്കെ എന്തോ ചെയ്യണം എടാ പട്ടി നാറീ പൂറി മോനെ തന്തയില്ലാത്ത നാറി മാന്യത ഇല്ലാതായി പോലും  പലപ്പോഴും പറഞ്ഞിട്ടില്ലേ
C,H_ML_001_C_M_048_008,പറഞ്ഞു കളിയാക്കുന്നത് തന്തയ്ക്കു പിറന്ന പൂറി മോൻ  ആണെങ്കിൽ എൻറെ അടുത്ത് നേരിട്ട് വന്ന് പറയടാ നായിക്ക് പിറന്ന മോനേ
C,H_ML_001_C_M_048_009,24 മണിക്കൂറും തെറി വിളിക്കുന്നവന്മാരാ എന്നിട്ട് ഈ പൂറി പുണ്ടച്ചി തയോളി നീയെന്നെ കൊണക്കാൻ വന്നേക്കുന്നു
C,H_ML_001_C_M_048_010,നീയെന്താ ചെലയ്ക്കുന്ന എന്റെ മൈരേ പൂറി മോനെ ഞാനെൻറെ സൗകര്യമുള്ള പോലെ ചിലക്കുമെടാ നിനക്കെന്തെങ്കിലും കഴപ്പ് ഉണ്ടോ മൈരേ
N,NH_ML_001_N_M_001_001,ഇതുവരെ ആളുകളൊക്കെ പലപ്പോഴും പറയുന്ന കിട്ടുകയാണ് ഭയങ്കര മൂഡ് ഓഫ് ആണ് എന്തോ ശരിയല്ല ഒരു സന്തോഷം കിട്ടുന്നില്ല ഹാപ്പിനെസ്സ് മൂഡോഫ് അങ്ങനെ പറഞ്ഞത്
N,NH_ML_001_N_M_001_002,എപ്പോഴെങ്കിലും നിനക്ക് എങ്ങനെ തോന്നി മാസത്തിലെ നമ്മുടെ മൂഡോഫ് മൂഡോഫ് തീരുമാനിക്കും നമ്മൾ പ്രിയ
N,NH_ML_001_N_M_001_003,മുമ്പ് പല വീഡിയോ ചെയ്തിട്ടുണ്ട് ഹാപ്പി ഓർമയുണ്ട് ചെയ്‌തിട്ടുണ്ട്‌
N,NH_ML_001_N_M_001_004,ഏറ്റവും പ്രധാനപ്പെട്ട മൂഡ് ഓൺ ആക്കുന്ന നമ്മുടെ നശിപ്പിക്കാൻ നടക്കുന്ന നമ്മുടെ സന്തോഷിപ്പിക്കുന്നത് ഡൊമൈൻ മുന്നിലാണ്
N,NH_ML_001_N_M_001_005,ഞാനെന്നനാചർൽ ആയിട്ട് തന്നെ നമ്മുടെ ഡൊമൈൻ ശെരി അളവ് കൂട്ടാൻ
N,NH_ML_001_N_M_001_006,അതുവഴി എങ്ങനെ അപ്പോൾ നമുക്ക് ഹാപ്പി ആയി
N,NH_ML_001_N_M_001_007,അളവ് കുറയുമ്പോൾ മൂഡ് ബാലൻസ് മാത്രമല്ല നമുക്ക് ആങ്സൈറ്റി. ഉണ്ടാവാൻ ഡിപ്രഷൻ ഉണ്ടാവാം ഒരുപക്ഷേ നമുക്ക് ഉദ്ദേശിച്ച അടക്കമുള്ള എപ്പോഴും ഒരു ഓരോ 100 ആയുസ്സ്
N,NH_ML_001_N_M_001_008,വിജയിക്കാം അതുകൊണ്ട് നമ്മുടെ എപ്പോഴും നമ്മുടെ ബാലൻസ് ചെയ്തു നിർത്തുന്നത്
N,NH_ML_001_N_M_001_009,ഉത്തരവാദിത്വമാണ് വളരെ നാച്ചുറൽ ആയിട്ട് നമ്മുടെ നിത്യജീവിതത്തിലെ ചില കാര്യങ്ങൾ ശ്രദ്ധിച്ചാൽ നമുക്ക് അങ്ങ് ബാലൻസ് ചെയ്യാനും നാം
N,NH_ML_001_N_M_001_010,ഒപ്പം കിട്ടാൻ എപ്പോഴും മാറ്റി എടുക്കാൻ പറ്റും
N,NH_ML_001_N_M_001_011,ഇങ്ങനെ നമുക്ക് നോക്കാം ഒന്നാമത്തെ കാര്യം നടന്നു നമ്മൾ
N,NH_ML_001_N_M_001_012,കണക്ക് ഇരിക്കാൻ ഉള്ളതാണ് എന്ന് പറഞ്ഞാൽ ഒറ്റയ്ക്ക് ഒരു മുറിയിലെ ഒറ്റപ്പെട്ട ഇരിക്കുന്നതിന ഇൻറ്റ്റോവർറ്റ് ആയിരിക്കുന്ന ആളുകളെയും കണക്ഷൻ ഇല്ലാത്ത ഫോണിൽ
N,NH_ML_001_N_M_001_013,ഇല്ലാത്ത ഫാമിലിയിൽ ആരെങ്കിലും വീട്ടിൽ വരുമ്പോൾ പോലും ബുദ്ധിമുട്ട് തോന്നുന്ന വൈകി
N,NH_ML_001_N_M_001_014,പ്രിയമാനസം ഇത് പുറത്തു പോയി കഴിഞ്ഞാൽ ആളുകളോട് സംസാരിക്കാൻ ഇഷ്ടമില്ലാത്ത അവസ്ഥയാണെങ്കിൽ അപ്പുറത്ത് നിങ്ങളോടൊപ്പം വിളവ് കുറയുന്ന എപ്പോഴാണ്
N,NH_ML_001_N_M_001_015,കൂടെ യാത്രയിൽ സംഭവം
N,NH_ML_001_N_M_001_016,കൂടെ ഒരുമിച്ച് സംസാരിക്ക്
N,NH_ML_001_N_M_001_017,നടത്തുക ഇനി അല്ലെങ്കിൽ ഫോണിലൂടെ എങ്കിലും കണക്ഷൻ കിട്ടി എന്തെങ്കിലും നിങ്ങൾക്കൊപ്പം ഉണ്ടാവുന്നതാണ് ഹാപ്പി ഓർമ്മ ഉണ്ടാവുന്നതാണ്
N,NH_ML_001_N_M_001_018,നമുക്ക് വിജയേട്ടൻ നേടിയെടുക്കാവുന്ന
N,NH_ML_001_N_M_001_019,അത് നിങ്ങൾ എപ്പോഴെങ്കിലും ലൈഫിലെ ഒന്നു സ്ഥിരമായിട്ട് ഇളക്കുക
N,NH_ML_001_N_M_001_020,ഇടയ്ക്കെങ്കിലും വല്ലപ്പോഴും എസ്എസ്എൽസി ഇത് ഒന്നുകൂടി ഉണ്ടാവാം അല്ലെങ്കിൽ എവിടെയെങ്കിലും വെച്ചിട്ട് ജിം എക്യുമെൻസ് കടപ്പുറം ചുമ്മാ എന്തെങ്കിലും വർക്ക്  ഔറ്റ്
N,NH_ML_001_N_M_001_021,അങ്ങനെ ചെയ്യുമ്പോൾ ബുദ്ധിമുട്ടാ ചെയ്തു കഴിഞ്ഞിട്ട് വല്ലാത്ത ഒരു റിലാക്സേഷൻ
N,NH_ML_001_N_M_001_022,ബോഡിയുടെ കൊന്നിട്ട് ഇരിക്കുമ്പോൾ ഒരു വല്ലാത്ത സുഖല്ലേ സത്യത്തിൽ ആ ട്രെയിൻ ഉണ്ടോ
N,NH_ML_001_N_M_001_023,എന്നുള്ളതാണ് അതുകൊണ്ട് ഇന്നും ഡെയിലി മിനിമം 10 മിനിറ്റ് മാക്സിമം എത്രയാവും അരമണിക്കൂറെങ്കിലും ഉണ്ടെങ്കിൽ കാര്യം എന്തെങ്കിലും എക്സൈസ് ചെയ്യാമെങ്കിൽ തീർച്ചയായും ഉണ്ട്
N,NH_ML_001_N_M_001_024,പ്രൊഡക്ഷൻ ഉണ്ടാക്കുന്നത് ട്രേയിലേക്ക് ഇടുകയാണെങ്കിൽ നമ്മൾക്ക് എപ്പോഴും ഒരു ഉന്മേഷം കിട്ടാൻ പറ്റുന്നതാണ്
N,NH_ML_001_N_M_001_025,ഈ മൂവ്മെൻറ് ശരീരം ചലിപ്പിക്കുക ശരീരം നടത്തുമോ ഏതെങ്കിലും രീതിയിൽ എസ്ഐ തിരഞ്ഞാൽ നിങ്ങൾക്ക് ഡൊമൈൻ
N,NH_ML_001_N_M_001_026,സിംപിളാണ് മൂന്നാമത് ഫിസിക്കൽ ടച്ച്
N,NH_ML_001_N_M_001_027,നിങ്ങൾക്ക് ഏറ്റവും ഇഷ്ടപ്പെട്ട ആൾ നിങ്ങളെ ഹഗ് ചെയ്യുമ്പോൾ നിങ്ങളെ ഇഷ്ടപ്പെട്ട ആൾ ഇങ്ങോട്ട് ഹഗ് ചെയ്യുമ്പോൾ അപ്പോഴൊക്കെ നമുക്ക് വല്ലാത്തൊരു നിർവൃദ്ധിയും സുഖം തോന്നും
N,NH_ML_001_N_M_001_028,അത് മറ്റൊന്നും കൊണ്ടല്ല ഡോക്യുമെൻററി പ്ലീസ് ആണ് അതുകൊണ്ട് സാധാരണക്കാരനും ദാമ്പത്യത്തിലേക്ക് ഭാര്യ ഭർത്താക്കന്മാരെ എങ്ങും എന്തെല്ലാം അടി ഉണ്ടായാലും എന്നും വീട്ടിനു പുറത്തു പോകുന്നത് ഭാര്യ അല്ലെങ്കിൽ ഭർത്താവ് എന്ന ഭംഗിയാണ് 20 സെക്കൻഡ്
N,NH_ML_001_N_M_001_029,അവർക്കിടയിൽ ബിസി വളരെയധികം വർധിക്കുന്നു ഡാൻഡ്രഫ് ഉണ്ടാവുന്നതാണ് അതിലൊന്നാണ് ഭരണം കുഞ്ഞുമക്കൾ
N,NH_ML_001_N_M_001_030,രചന നിങ്ങൾ ആലോചിക്കും നിങ്ങൾക്ക് ഇഷ്ടമുള്ള ഒരാൾ നിങ്ങടെ പുറത്തൊന്നും മസാജ് ചെയ്യുമ്പോൾ നിങ്ങൾ തലയിൽ ഒന്ന് മസാജ്
N,NH_ML_001_N_M_001_032,വിച്ച് ചേർത്തുപിടിക്കുക അധിക തലയിലും പുറത്തും മസാജ് കൊടുക്കുക
N,NH_ML_001_N_M_001_033,മസാജ് ചെയ്യുക നമ്മുടെ മസാജ് ചെയ്താൽ നമ്മൾ മറ്റുള്ളവർ മസാജ് ചെയ്താൽ ഈ പെർമ സജീവ പോലും അവർക്കും നമുക്കും അതിൽ
N,NH_ML_001_N_M_001_034,അവളാണ് സോപ്പ് കിതച്ച് എപ്പോഴും ആ നിലനിർത്തുക ആട് ചിലർ നമുക്ക് കഴിയും
N,NH_ML_001_N_M_001_035,തകർന്ന എപ്പോഴും മൂഡ് . പ്രധാനപ്പെട്ട ഒരു കാര്യം പറഞ്ഞത് നമ്മൾ ഇങ്ങനെ ചെലവ് മുബാറക്ക് ഇന്നലെ ഇന്നലെ ഉറങ്ങിയിട്ടില്ല എന്നതും
N,NH_ML_001_N_M_001_036,ഉറക്കം കുറഞ്ഞു കഴിഞ്ഞാൽ അത് മുഖത്ത് വേറെ തന്നെ കാണും എപ്പോഴും ഈ കാരി ആ കൂടെ അങ്ങനെ ഒരു ക്ഷീണിച്ച അവസ്ഥ
N,NH_ML_001_N_M_001_037,അതുകൊണ്ട് ഗേറ്റിന് സ്ലീപ് എന്നതാണ് ഉറങ്ങുക ധാരാളം ഉറങ്ങുക അത് നമ്മൾ സാധാരണ പറയാറുള്ള സ്പീക്കർ
N,NH_ML_001_N_M_001_038,അത് പ്രത്യേകിച്ചും അവനവൻറെ പിന്നെ ജോലിഭാരം ഒക്കെ അനുസരിച്ചാണ് എന്നാലും ഒരു സെവൻ അപ്പ് സിംഗിൾ ഉറങ്ങാൻ സമയം
N,NH_ML_001_N_M_001_039,അത് നല്ല ടിപ്സ് കൃപയാൽ കാർഡ് നിർത്തിയാൽ വളരെ നല്ലതാണ്
N,NH_ML_001_N_M_001_040,ആവശ്യത്തിന് ഉറക്കം ലഭിക്കുന്ന ആളുകളുടെ ഡൊമൈന് കുറവും ഉണ്ടാവില്ല എന്നതാണ് പഠന പറയ്
N,NH_ML_001_N_M_001_041,പോലും നമുക്ക് ഡോക്യുമെൻററി ചെയ്യാൻ പറ്റും അല്ലേ ടൈറോസ് എന്ന് പറയുന്ന പേര് പ്രോട്ടീന് മനസ്സുകളിൽ ഉള്ള
N,NH_ML_001_N_M_001_042,പോലും നമുക്ക് ഡോക്യുമെൻററി ചെയ്യാൻ പറ്റും അല്ലേ ടൈറോസ് എന്ന് പറയുന്ന പേര് പ്രോട്ടീന് മനസ്സുകളിൽ ഉള്ള
N,NH_ML_001_N_M_001_043,വയ്ക്കാനുള്ള മിക്കവാറും ആ പ്രോട്ടീൻ റിച്ചാർഡ് ഭക്ഷണങ്ങൾ ഏതു കഴിച്ചാൽ മുട്ട ആണെങ്കിലും പാൽ ആണെങ്കിലും അപേക്ഷ മാംസങ്ങൾ അതുപോലെ ബീൻസ് ഇങ്ങനെയുള്ള ഭക്ഷണത്തിൽ ഒക്കെ നടക്കട്ടെ
N,NH_ML_001_N_M_001_044,ഫിറോസിനെ അളവ് ബാലൻസ് കൊണ്ടാണെങ്കിൽ അപ്പോഴും നമുക്ക് ഭൂമി അളവ് കൂടും ഹാപ്പി ഓർമ്മത്തെറ്റുകൾ
N,NH_ML_001_N_M_001_045,ആദ്യം പറയുന്ന കാര്യങ്ങൾ നമ്മൾ എപ്പോൾ സൂചിപ്പിക്കുന്ന കാര്യമാണ് എന്തെല്ലാം മാനസിക പ്രശ്നം ഉണ്ടെങ്കിൽ എപ്പോഴൊക്കെ ഡിപ്രഷൻ ഉണ്ടെങ്കിലും എപ്പോഴാ അനുസരിച്ച് ഉണ്ടെങ്കിലും എപ്പോഴൊക്കെ മൂഡോഫ് ആണെങ്കിലും എപ്പോഴും നല്ലൊരു കാര്യം നടന്നത്
N,NH_ML_001_N_M_001_046,തെറ്റിയതാണ് മിനിമം 10 മിനിറ്റിനു മേലെ നിങ്ങൾ മെഡിറ്റേറിയൻ മറ്റൊരു കാര്യം ശ്രദ്ധിക്കാതെ ഓർത്താൽ മാത്രം ശ്രദ്ധിച്ചുകൊണ്ട് ഒരു പോയിൻറ് മാത്രം ശ്രദ്ധിച്ചു കൊണ്ട് നിങ്ങൾക്ക്
N,NH_ML_001_N_M_001_047,നിൽക്കാൻ വെഡിങ് ഡേറ്റ് നില്ക്കാൻ പറ്റുമെങ്കിൽ എല്ലാ അനാവശ്യമായ ചിന്തകളും നെഗറ്റീവ് എനർജി
N,NH_ML_001_N_M_001_048,റിലീസിനെത്തും നല്ലൊരു കാര്യം നേച്ചർ നിങ്ങളാണ് കാമമോഹിതം ഉണ്ടാകും ആ ഒരു ഫീലിങ് ഉണ്ടാക്കാൻ വേണ്ടി മെഡി
N,NH_ML_001_N_M_001_049,അവർ അങ്ങനെ ചെയ്തു കൊണ്ടേയിരിക്കുന്നു ജോലി സ്ഥിരം ചെയ്യുമ്പോഴാണ് പലർക്കും ഈ മൂഡ് ഉണ്ടാകുന്നതെന്ന് മടുത്തു തുടങ്ങി
N,NH_ML_001_N_M_001_050,അടുത്തുള്ള വാക്ക് ഉപയോഗിക്കുന്നത് അതുകൊണ്ട് എപ്പോഴും നമ്മുടെ സ്ഥിരമായിട്ട് ഏത് ജോലിയാണെങ്കിലും സർക്കാർ ജോലി ആണെങ്കിൽ പ്രൈവറ്റ് ജോബ് ആണെങ്കിൽ സ്വന്തം ബിസിനസ് ആണെങ്കിലും വീട്ടുജോലി ആണെങ്കിൽ കൃഷി ആണെങ്കിൽ എന്താണെങ്കിലും ആ ചെയ്തു കൊണ്ടേ ഇരിക്കുന്നതിൽ എന്തെങ്കിലും
N,NH_ML_001_N_M_001_051,മധുരം ഇതുവരെ ചെയ്തതിൽ വ്യത്യസ്തമായി ട്രൈ സംതിങ് ന്യൂ പുതിയതൊന്ന് കൊണ്ടുവരികയും അത് സാമൂഹിക ഫെയർ ആഭരണങ്ങളോട് ആ ടീമിന് നമുക്ക് ഹാപ്പിനസ് ഉണ്ടാകുന്നതാണ് ഹാപ്പി ഓണം
N,NH_ML_001_N_M_001_052,സക്സസ് ആയിട്ടില്ലെങ്കിൽ സ്വഭാവം ഒരു ശ്രമിച്ചുകൊണ്ടേയിരിക്കും ഓരോ തവണ പുതിയ ശ്രമിക്കുമ്പോഴും നമുക്ക് കൂടുതൽ കൂടുതൽ എനർജി കിട്ടുന്നതാണ്
N,NH_ML_001_N_M_001_053,ശരിക്കും ഹാപ്പിനസ് കിട്ടുന്ന ഹാപ്പി ഹോർമോൺ
N,NH_ML_001_N_M_001_054,മണ്ണ് എല്ലാദിവസവും നമ്മുടെ ചെയ്യേണ്ട ജോലിക്ക് ഒരു ലിസ്റ്റ് ഉണ്ടാവുക എന്തൊക്കെ ചെയ്യണമെന്ന് ബെസ്റ്റ് ഉണ്ടാക്കുകയും ആ ജോലി ചെയ്തു തീർന്നു എന്ന് നമ്മൾ ഒരു
N,NH_ML_001_N_M_001_055,മാർക്ക് എന്നു പറഞ്ഞാൽ അത് മനസ്സുകൊണ്ട് ചെയ്താലും മൊബൈൽ ചെയ്താലും പേപ്പർ ചെയ്താലും ഡയറിയിൽ ചെയ്താലും നമ്മൾ ചെയ്തു എന്ന് ആത്മനിർവൃതി ഉണ്ടാകുന്നതോടെ ഹാപ്പിനസ്
N,NH_ML_001_N_M_001_056,ഇന്ന് ചെയ്യണമെന്ന് ആഗ്രഹിച്ച അഞ്ചു കാര്യങ്ങളാണ് അതിലെ ഒരെണ്ണം പത്തനാപുരത്തിന് ചെയ്തു കഴിഞ്ഞ് 10 ദിവസം കിട്ടും ഉച്ചയ്ക്ക് വന്നു ചെയ്തു വൈകുന്നേരം ഇരുന്ന് ചെയ്യാൻ ഉദ്ദേശിച്ച എല്ലാ ജോലിയും ചെയ്തു എന്ന തോന്നൽ ഉണ്ടാകും എന്ന് ചിന്തയുണ്ടായിരുന്നു കഥാപ്രസംഗം ശോകം
N,NH_ML_001_N_M_001_057,പാസന ടാസ്ക് ടാസ്ക് കംപ്ലീറ്റ് ചെയ്യുക
N,NH_ML_001_N_M_001_058,ഭാഗമാണ് നിങ്ങൾ എങ്കിൽ അതിനെ കുഞ്ഞുകുഞ്ഞു ടാസ്കുകൾ ആക്കി മാറ്റുക
N,NH_ML_001_N_M_001_059,ഫാസ്റ്റ് കമ്പ്ലീറ്റ് എപ്പോഴും ഹാപ്പി ഓർമപ്പെടുത്തലുകളാണ്
N,NH_ML_001_N_M_001_060,നടന്നത് നമ്മുടെ മിക്ക ആളുകളും വൈകുന്നേരം ഒരു പാർക്കിൽ ഒരു ബീച്ചിൽ ഉപയോഗിക്കാറുണ്ട് നല്ല റിസോർട്ടുകളിൽ അല്ലെങ്കിൽ അത്തരം ആംബിയൻസ് ഉള്ള സ്ഥലത്ത് നല്ല പ്രകൃതിരമണീയമായ സ്ഥലം എവിടെ പോയി നിൽക്കും നമ്മൾപോലും അറിയാത്ത ഒരു സ്വപ്നം റോഡിലേക്ക് ഉണ്ടാകും പ്രകൃതി
N,NH_ML_001_N_M_001_061,നേച്ചർ പ്രകൃതിയും ആയിട്ട് നല്ലൊരു കണക്ഷൻ കെപിഎം എപ്പോഴാണോ അപ്പോഴൊക്കെ നമുക്ക് കോൺഗ്രസുകാരൻ അപ്പോഴേ ഹാപ്പി വുമൺസ് കിട്ടും അത് ഓരോരുത്തർ
N,NH_ML_001_N_M_001_062,പലർക്കും ബീച്ചിന് ഭാഗത്തേക്ക് പോകുന്ന ഇഷ്ടല്ല അവർക്ക് മറ്റു കാടുകളിൽ പൊന്നാനിക്ക് ഇഷ്ടം സൺസെറ്റ് കാണുമായിരിക്കാം സൺറൈസ് കാണുന്നത് ആയിരിക്കാം അല്ലെങ്കിൽ ആവില തോട്ടങ്ങളിൽ പരിഹരിക്കാൻ കാപ്പി തോട്ടത്തിൽ ഏലത്തോട്ടത്തിൽ ഓഹ് പിന്നെ ചായ തോട്ടത്തിൽ കത്തിനിൽക്കുമ്പോൾ നല്ലൊരു സുഖം തോന്നുന്നുണ്ടെങ്കിൽ
N,NH_ML_001_N_M_001_063,നെയ്ച്ചോറും ആയിട്ട് കണക്ട് ആകുമ്പോ നമുക്ക് സുഹൃത്ത് കിട്ടുന്നതാണ് അത് ഏതാണ് നഗരത്തിലാണ് എൻജോയ് മെൻറ് കണ്ടെത്താൻ പറ്റുന്ന ഓരോരുത്തർ മനസ്സിലാക്കുക
N,NH_ML_001_N_M_001_064,അങ്ങനെ നീ എപ്പോഴും ഹാപ്പി ഓണം സ്കൂൾ
N,NH_ML_001_N_M_001_065,അവർക്കും വാദകൻ അല്ലെങ്കിൽ നല്ലൊരു ശതമാനം ആളുകൾക്കും ഗുണം ചെയ്യുന്ന അല്ലെങ്കിൽ റിലീസിങ് കാരണമാകുന്ന ഒരു കഥ
